<?xml version="1.0" encoding="UTF-8"?>
<!DOCTYPE xml>
<layout desc="지급 이체 요청" xmlns:xsi="http://www.w3.org/2001/XMLSchema-instance" xsi:noNamespaceSchemaLocation="./layout.xsd">

	<field name="MESSAGECODE"	maxBytes="4"	required="Y"	type="C"	desc="메시지코드" />
	<field name="SERVICECODE"	maxBytes="3"	required="Y"	type="C"	desc="업무구분코드" />
	<field name="GRPBIZNO"		maxBytes="13"	required="Y"	type="C"	desc="단지사업자번호" />
	<field name="MEMBIZNO"		maxBytes="13"	required="Y"	type="C"	desc="상사사업자번호" />
	<field name="ISSUENO"		maxBytes="20"	required="Y"	type="C"	desc="거래고유번호" />
	
	<field name="OUTBANKCD"		maxBytes="3"	required="Y"	type="C"	desc="출금은행코드" />
	<field name="OUTACCTNO"		maxBytes="15"	required="Y"	type="C"	desc="출금계좌번호" />
	<field name="OUTACCTPW"		maxBytes="8"	required="N"	type="C"	desc="출금계좌비밀번호" />
	<field name="OUTAMT"		maxBytes="13"	required="Y"	type="C"	desc="출금금액" />
	<field name="OUTDESC"		maxBytes="20"	required="N"	type="C"	desc="출금계좌적요" />
	
	<field name="INBANKCD"		maxBytes="3"	required="Y"	type="C"	desc="입금은행코드" />
	<field name="INACCTNO"		maxBytes="15"	required="Y"	type="C"	desc="입금계좌번호" />
	<field name="INDESC"		maxBytes="20"	required="Y"	type="C"	desc="입금계좌적요" />
	
	<field name="CMSCD"			maxBytes="16"	required="N"	type="C"	desc="CMS코드" />
	<field name="SALARYYN"		maxBytes="1"	required="N"	type="C"	desc="급여구분" />
</layout>