<?xml version="1.0" encoding="UTF-8"?>
<!DOCTYPE xml>
<layout desc="잔액 조회 요청" xmlns:xsi="http://www.w3.org/2001/XMLSchema-instance" xsi:noNamespaceSchemaLocation="./layout.xsd">

	<field name="MESSAGECODE"	maxBytes="4"	required="Y"	type="C"	desc="메시지코드" />
	<field name="SERVICECODE"	maxBytes="3"	required="Y"	type="C"	desc="업무구분코드" />
	<field name="GRPBIZNO"		maxBytes="13"	required="Y"	type="C"	desc="단지사업자번호" />
	<field name="MEMBIZNO"		maxBytes="13"	required="Y"	type="C"	desc="상사사업자번호" />
	<field name="ISSUENO"		maxBytes="20"	required="Y"	type="C"	desc="거래고유번호" />
	<field name="BANKCD"		maxBytes="3"	required="Y"	type="C"	desc="조회대상은행코드" />
	<field name="ACCTNO"		maxBytes="15"	required="Y"	type="C"	desc="조회대상계좌번호" />
</layout>