<?xml version="1.0" encoding="UTF-8"?>
<!DOCTYPE xml>
<layout desc="상사 사업자정보 등록" xmlns:xsi="http://www.w3.org/2001/XMLSchema-instance" xsi:noNamespaceSchemaLocation="./layout.xsd">

	<field name="MESSAGECODE"	maxBytes="4"	required="Y"	type="C"	desc="메시지코드" />
	<field name="SERVICECODE"	maxBytes="3"	required="Y"	type="C"	desc="업무구분코드" />
	<field name="GRPBIZNO"		maxBytes="13"	required="Y"	type="C"	desc="단지사업자번호" />
	<field name="MEMBIZNO"		maxBytes="13"	required="Y"	type="C"	desc="상사사업자번호" />
	<field name="MEMNM"			maxBytes="100"	required="Y"	type="C"	desc="상사사업자명" />
	<field name="CHANNEL"		maxBytes="30"	required="Y"	type="C"	desc="전용선 업체코드" />
	<field name="BANKCD"		maxBytes="3"	required="Y"	type="C"	desc="은행코드" />
	<field name="FBSCODE"		maxBytes="8"	required="Y"	type="C"	desc="FBS업체코드" />
	<field name="RECCODEYN"		maxBytes="1"	required="Y"	type="C"	desc="복기부호 사용여부" />
</layout>