<?xml version="1.0" encoding="UTF-8"?>
<!DOCTYPE xml>
<layout desc="거래내역조회 요청" xmlns:xsi="http://www.w3.org/2001/XMLSchema-instance" xsi:noNamespaceSchemaLocation="./layout.xsd">

	<field name="MESSAGECODE"	maxBytes="4"	required="Y"	type="C"	desc="메시지코드" />
	<field name="SERVICECODE"	maxBytes="3"	required="Y"	type="C"	desc="업무구분코드" />
	<field name="GRPBIZNO"		maxBytes="13"	required="Y"	type="C"	desc="단지사업자번호" />
	<field name="MEMBIZNO"		maxBytes="13"	required="Y"	type="C"	desc="상사사업자번호" />
	<field name="ISSUENO"		maxBytes="20"	required="Y"	type="C"	desc="거래고유번호" />
	<field name="BANKCD"		maxBytes="3"	required="Y"	type="C"	desc="조회은행코드" />
	<field name="CURRCD"		maxBytes="3"	required="Y"	type="C"	desc="조회통화코드" />
	<field name="ACCTNO"		maxBytes="15"	required="N"	type="C"	desc="조회계좌번호" />
	<field name="SDATE"			maxBytes="8"	required="Y"	type="C"	desc="조회시작일자" />
	<field name="EDATE"			maxBytes="8"	required="Y"	type="C"	desc="조회종료일자" />
	<field name="CURRPAGENO"	maxBytes="5"	required="Y"	type="C"	desc="요청페이지" />
</layout>